{
  "commentaryEntryId": "54545454-5454-4545-8545-545454545454",
  "researchReleaseId": "11111111-1111-4111-8111-111111111111",
  "referenceSpanId": "17171717-1717-4171-8171-171717171717",
  "commentaryKind": "TRANSLATION_NOTE",
  "title": "Fixture translation note",
  "summary": "Fixture only.",
  "reviewStatus": "NEEDS_REVIEW",
  "contentHash": "1717171717171717171717171717171717171717171717171717171717171717",
  "sections": [
    {
      "sectionId": "55555555-aaaa-4555-8aaa-555555555555",
      "sectionType": "TRANSLATION_IMPLICATIONS",
      "sectionOrder": 0,
      "renderedText": "Fixture only.",
      "assertionIds": [
        "18181818-1818-4181-8181-181818181818"
      ],
      "evidenceItemIds": [
        "19191919-1919-4191-8191-191919191919"
      ]
    }
  ]
}
